<?xml version="1.0"?>

<AtomicSoundComponent xmlns="soundgates" xmlns:xsi="http://www.w3.org/2001/XMLSchema-instance" xsi:schemaLocation="../Soundgates model/atomicComponent.xsd">
	<Type>NumericSineGenerator</Type>
	<Ports>
		<Port Name="Resolution" Direction="IN" DataType="CONTROL"/>
		<Port Name="Frequency" Direction="IN" DataType="CONTROL"/>
		<Port Name="Output" Direction="OUT" DataType="CONTROL"/>
	</Ports>
	<Properties>
	</Properties>
	<Code>
		<Simulation>
		</Simulation>
		<Hardware>
			VHDL Stuff
		</Hardware>
	</Code>
</AtomicSoundComponent>
