<?xml version="1.0"?>

<AtomicSoundComponent xmlns="soundgates" xmlns:xsi="http://www.w3.org/2001/XMLSchema-instance" xsi:schemaLocation="../Soundgates model/atomicComponent.xsd">
	<Type>Constant</Type>
	<Ports>
		<Port Name="Value" Direction="OUT" DataType="FLOAT"/>
	</Ports>
	<Properties>
		<FloatProperty Name="Value" InitialValue="0"/>
	</Properties>
	<Code>
		<Simulation>
			PD Code
		</Simulation>
		<Hardware>
			VHDL Stuff
		</Hardware>
	</Code>
</AtomicSoundComponent>