<?xml version="1.0"?>

<AtomicSoundComponent xmlns="soundgates" xmlns:xsi="http://www.w3.org/2001/XMLSchema-instance" xsi:schemaLocation="../Soundgates model/atomicComponent.xsd">
	<Type>NumericDivision</Type>
	<Ports>
		<Port Name="Dividend" Direction="IN" DataType="CONTROL"/>
		<Port Name="Divisor" Direction="IN" DataType="CONTROL"/>
		<Port Name="Quotient" Direction="OUT" DataType="CONTROL"/>
	</Ports>
	<Properties>
	</Properties>
	<Code>
		<Simulation/>
		<Hardware>
			VHDL Stuff
		</Hardware>
	</Code>
</AtomicSoundComponent>
